abbrev,name,street,city,state,zip,lat,lon,type,2005-06,2006-07,2007-08,2008-09,2009-10,2010-11,2011-12,2012-13,2013-14,2014-15,ACOM,Alabama College of Osteopathic Medicine,445 Health Sciences Blvd.,Dothan,AL,36303,31.266568,-85.401317,parent,,,,,,,,,150,150,ATSU-KCOM,A. T. Still University - Kirksville College of Osteopathic Medicine,800 W. Jefferson,Kirksville,MO,63501,40.165717,-92.609514,parent,160,160,160,160,160,160,160,160,160,160,ATSU-SOMA,A.T. Still University - School of Osteopathic Medicine in Arizona,5850 E. Still Circle,Mesa,AZ,85206,33.38387395,-111.7041822,parent,,,100,100,100,100,100,100,100,100,CUSOM,Campbell University Jerry M. Wallace School of Osteopathic Medicine,P.O. Box 4280,Buies Creek,NC,27506,35.420467,-78.713729,parent,,,,,,,,,150,150,DMU-COM,Des Moines University College of Osteopathic Medicine,3200 Grand Ave.,Des Moines,IA,50312-4198,41.58445086,-93.66190082,parent,205,205,205,205,205,205,205,205,205,205,GA-PCOM,Georgia Campus-Philadelphia College of Osteopathic Medicine,625 Old Peachtree Road,Suwanee,GA,30024,34.042479,-84.026171,branch,80,80,80,80,80,80,125,125,125,125,KCUMB-COM,Kansas City University of Medicine and Biosciences' College of Osteopathic Medicine,1750 Independence Ave.,Kansas City,MO,64106,39.10667855,-94.56101521,parent,250,250,250,250,250,250,250,250,250,250,LECOM,Lake Erie College of Osteopathic Medicine,1858 W. Grandview Blvd.,Erie,PA,16509-1025,42.07993652,-80.10483179,parent,144,144,180,180,180,180,180,180,180,180,LECOM-Bradenton,Lake Erie College of Osteopathic Medicine-Bradenton,5000 Lakewood Ranch Blvd.,Bradenton,FL,34211-4909,27.41079344,-82.42796033,branch,150,150,150,150,150,150,182,182,182,182,LECOM-Seton Hill,Lake Erie College of Osteopathic Medicine - Seton Hill,20 Seton Hill Drive,Greensburg,PA,15601,40.313525,-79.558876,additional,,,,,104,104,104,104,104,104,LMU-DCOM,Lincoln Memorial University-DeBusk College of Osteopathic Medicine,6965 Cumberland Gap Parkway,Harrogate,TN,37752,36.57625408,-83.65481751,parent,,,150,150,150,150,150,225,225,225,LUCOM,Liberty University College of Osteopathic Medicine,306 Liberty View Lane,Lynchburg,VA,24502,37.33885924,-79.17450353,parent,,,,,,,,,,150,MSUCOM,Michigan State University College of Osteopathic Medicine,A-309 East Fee Hall,East Lansing,MI,48824,42.728334,-84.488226,parent,200,200,200,200,200,200,200,200,200,200,MSUCOM-DMC,Michigan State University College of Osteopathic Medicine - Detroit Medical Center,4707 Saint Antoine St.,Detroit,MI,48201,42.35850578,-83.05641392,additional,,,,,50,50,50,50,50,50,MSUCOM-MUC,Michigan State University College of Osteopathic Medicine - Macomb University Center,44575 Garfield Rd.,Clinton Twp.,MI,48038,42.624261,-82.953332,additional,,,,,50,50,50,50,50,50,MU-COM,Marian University College of Osteopathic Medicine,3200 Cold Spring Rd.,Indianapolis,IN,46222-1997,39.81493283,-86.20112933,parent,,,,,,,,,150,150,MWU/AZCOM,Midwestern University/ Arizona College of Osteopathic Medicine,19555 N. 59th Ave.,Glendale,AZ,85308,33.661597,-112.1865039,parent,140,140,140,250,250,250,250,250,250,250,MWU/CCOM,Midwestern University/Chicago College of Osteopathic Medicine,555 31st St.,Downers Grove,IL,60515,41.831362,-87.996907,parent,160,160,160,160,206,206,206,206,206,206,NSU-COM,Nova Southeastern University College of Osteopathic Medicine,3200 S. University Drive,Fort Lauderdale,FL,33328,26.07585607,-80.25212745,parent,230,230,230,230,230,230,230,230,230,230,NYITCOM,New York Institute of Technology College of Osteopathic Medicine,Northern Blvd.,Old Westbury,NY,11568-8000,40.659234,-78.781694,parent,260,260,260,260,260,260,260,260,260,260,OSU-COM,Oklahoma State University Center for Health SciencesÌ´Ì_College of Osteopathic Medicine,1111 W. 17th St.,Tulsa,OK,74107,36.137626,-96.006952,parent,88,88,88,88,97,106,115,115,115,115,OU-HCOM,Ohio University Heritage College of Osteopathic Medicine at Athens,204 Grosvenor Hall,Athens,OH,45701,39.33734807,-82.09701532,parent,100,100,100,140,140,140,140,140,140,140,OU-HCOM Dublin,Ohio University Heritage College of Osteopathic Medicine at Dublin,6775 Bobcat Way,Dublin,OH,45701,39.339279,-82.013803,additional,,,,,,,,,,60,PCOM,Philadelphia College of Osteopathic Medicine,4170 City Ave.,Philadelphia,PA,19131-1610,40.00696857,-75.21416636,parent,250,250,250,250,250,250,250,250,250,250,PNWU-COM,"Pacific Northwest University of Health Sciences,College of Osteopathic Medicine",111 University Parkway,Yakima,WA,98901,46.59716826,-120.4522688,parent,,,,70,70,70,70,70,135,135,RowanSOM,Rowan University School of Osteopathic Medicine,42 E. Laurel Road,Stratford,NJ,8084,39.829763,-75.012012,parent,100,100,100,100,150,150,150,150,150,150,RVUCOM,Rocky Vista University College of Osteopathic Medicine,8401Ì´Ì_Chambers Road,Parker,CO,80134,39.54601664,-104.8097881,parent,,,,150,150,150,150,150,150,150,TouroCOM-Harlem,Touro College of Osteopathic Medicine in New York City,230 W. 125th St.,New York,NY,10027,40.80930486,-73.94955346,parent,,,125,125,125,125,125,125,125,125,TUCOM,"Touro University California, College of Osteopathic Medicine",1310 Club Dr.,Vallejo,CA,94592,38.08553406,-122.2678827,parent,125,125,125,125,125,125,125,125,125,125,TUNCOM,Touro University Nevada College of Osteopathic Medicine,874 American Pacific,Henderson,NV,89014,36.0423412,-115.0244752,branch,100,125,125,125,125,125,125,125,125,125,UNECOM,University of New England College of Osteopathic Medicine,11 Hills Beach Rd.,Biddeford,ME,4005,43.45761871,-70.38482935,parent,115,115,115,115,115,115,115,115,165,165,UNTHSC/TCOM,University of North Texas Health Science Center Texas College of Osteopathic Medicine,3500 Camp Bowie Blvd.,Fort Worth,TX,76107-2644,32.73024765,-97.41647649,parent,125,175,175,175,200,225,250,250,250,250,UP-KYCOM,University of Pikeville-Kentucky College of Osteopathic Medicine,147 Sycamore St.,Pikeville,KY,41501-1194,37.62933981,-82.54715024,parent,75,75,75,75,75,75,75,135,135,135,VCOM-Carolinas,Edward Via College of Osteopathic Medicine-Carolinas Campus,350 Howard St.,Spartanburg,SC,29303,34.95526386,-81.93895404,branch,,,,,,,150,150,150,150,VCOM-Virginia,Edward Via College of Osteopathic Medicine - Virginia Campus,2265 Kraft Drive,Blacksburg,VA,24060,37.19968868,-80.40613785,parent,150,150,150,175,175,175,175,175,175,175,WCUCOM,William Carey University College of Osteopathic Medicine,498 Tuscan Ave.,Hattiesburg,MS,39401,31.306193,-89.291691,parent,,,,,,100,100,100,100,100,WesternU/COMP,Western University of Health Sciences College of Osteopathic Medicine of the Pacific,309 E. 2nd St.,Pomona,CA,91766-1854,34.0579093,-117.7469714,parent,176,176,176,176,176,176,220,220,220,220,WesternU/COMP-Northwest,Western University of Health Sciences College of Osteopathic Medicine of the Pacific-Northwest,200 Mullins Dr.,Lebanon,OR,97355,44.526381,-122.827457,additional,,,,,,,100,100,100,100,WVSOM,West Virginia School of Osteopathic Medicine,400 N. Lee St.,Lewisburg,WV,24901,37.8016621,-80.4412409,parent,96,200,200,200,200,200,200,200,200,200,,,,,,,,,,,,,,,,,,,,